{
  "title": null,
  "properties": [],
  "sections": [
    {
      "name": "Intro",
      "heading": "markdown",
      "anchor": null,
      "body": [
        {
          "type": "music",
          "lines": [
            {
              "kind": "chart",
              "measures": [
                {
                  "bar": null,
                  "items": [
                    {
                      "type": "nochord"
                    }
                  ]
                },
                {
                  "bar": "|",
                  "items": [
                    {
                      "type": "nochord"
                    }
                  ]
                },
                {
                  "bar": "|",
                  "items": [
                    {
                      "type": "chord",
                      "symbol": "C",
                      "index": 1,
                      "key": "C",
                      "chord": {
                        "root": {
                          "letter": "C",
                          "accidental": 0
                        },
                        "quality": "major",
                        "extensions": [],
                        "bass": null
                      }
                    }
                  ]
                },
                {
                  "bar": "|",
                  "items": [
                    {
                      "type": "chord",
                      "symbol": "G7",
                      "index": 1,
                      "key": "G7",
                      "chord": {
                        "root": {
                          "letter": "G",
                          "accidental": 0
                        },
                        "quality": "major",
                        "extensions": [
                          {
                            "degree": 7,
                            "alter": -1
                          }
                        ],
                        "bass": null
                      }
                    }
                  ]
                }
              ],
              "closeBar": null
            },
            {
              "kind": "chart",
              "measures": [
                {
                  "bar": null,
                  "items": [
                    {
                      "type": "chord",
                      "symbol": "C",
                      "index": 1,
                      "key": "C",
                      "chord": {
                        "root": {
                          "letter": "C",
                          "accidental": 0
                        },
                        "quality": "major",
                        "extensions": [],
                        "bass": null
                      }
                    },
                    {
                      "type": "nochord"
                    },
                    {
                      "type": "chord",
                      "symbol": "G",
                      "index": 1,
                      "key": "G",
                      "chord": {
                        "root": {
                          "letter": "G",
                          "accidental": 0
                        },
                        "quality": "major",
                        "extensions": [],
                        "bass": null
                      }
                    }
                  ]
                },
                {
                  "bar": "|",
                  "items": [
                    {
                      "type": "nochord"
                    }
                  ]
                }
              ],
              "closeBar": null
            }
          ]
        }
      ],
      "groups": []
    },
    {
      "name": "Verse",
      "heading": "markdown",
      "anchor": null,
      "body": [
        {
          "type": "music",
          "lines": [
            {
              "kind": "sung",
              "measures": [
                {
                  "bar": null,
                  "items": [
                    {
                      "type": "nochord",
                      "column": 0,
                      "words": "When I firs"
                    },
                    {
                      "type": "chord",
                      "symbol": "C",
                      "index": 1,
                      "key": "C",
                      "chord": {
                        "root": {
                          "letter": "C",
                          "accidental": 0
                        },
                        "quality": "major",
                        "extensions": [],
                        "bass": null
                      },
                      "column": 11,
                      "words": "t saw you w"
                    },
                    {
                      "type": "chord",
                      "symbol": "G",
                      "index": 1,
                      "key": "G",
                      "chord": {
                        "root": {
                          "letter": "G",
                          "accidental": 0
                        },
                        "quality": "major",
                        "extensions": [],
                        "bass": null
                      },
                      "column": 22,
                      "words": "alking"
                    }
                  ]
                }
              ],
              "closeBar": null,
              "forced": false
            }
          ]
        }
      ],
      "groups": []
    }
  ],
  "blocks": [],
  "sung": true,
  "sungAt": 10,
  "diagnostics": []
}
