{
  "title": "Garota de Ipanema",
  "properties": [
    {
      "key": "artist",
      "value": "Tom Jobim"
    },
    {
      "key": "notation",
      "value": "brazilian"
    },
    {
      "key": "language",
      "value": "pt-BR"
    },
    {
      "key": "custom-key",
      "value": "anything goes here"
    }
  ],
  "sections": [
    {
      "name": "A",
      "heading": "markdown",
      "anchor": null,
      "body": [
        {
          "type": "music",
          "lines": [
            {
              "kind": "chart",
              "measures": [
                {
                  "bar": null,
                  "items": [
                    {
                      "type": "chord",
                      "symbol": "F7M",
                      "index": 1,
                      "key": "F7M",
                      "chord": {
                        "root": {
                          "letter": "F",
                          "accidental": 0
                        },
                        "quality": "major",
                        "extensions": [
                          {
                            "degree": 7,
                            "alter": 0
                          }
                        ],
                        "bass": null
                      }
                    }
                  ],
                  "number": 1,
                  "stated": false
                },
                {
                  "bar": "|",
                  "items": [
                    {
                      "type": "chord",
                      "symbol": "G7",
                      "index": 1,
                      "key": "G7",
                      "chord": {
                        "root": {
                          "letter": "G",
                          "accidental": 0
                        },
                        "quality": "major",
                        "extensions": [
                          {
                            "degree": 7,
                            "alter": -1
                          }
                        ],
                        "bass": null
                      }
                    }
                  ],
                  "number": 2,
                  "stated": false
                },
                {
                  "bar": "|",
                  "items": [
                    {
                      "type": "chord",
                      "symbol": "Gm7",
                      "index": 1,
                      "key": "Gm7",
                      "chord": {
                        "root": {
                          "letter": "G",
                          "accidental": 0
                        },
                        "quality": "minor",
                        "extensions": [
                          {
                            "degree": 7,
                            "alter": -1
                          }
                        ],
                        "bass": null
                      }
                    }
                  ],
                  "number": 3,
                  "stated": false
                },
                {
                  "bar": "|",
                  "items": [
                    {
                      "type": "chord",
                      "symbol": "Gb7(5-)",
                      "index": 1,
                      "key": "Gb7(5-)",
                      "chord": {
                        "root": {
                          "letter": "G",
                          "accidental": -1
                        },
                        "quality": "major",
                        "extensions": [
                          {
                            "degree": 5,
                            "alter": -1
                          },
                          {
                            "degree": 7,
                            "alter": -1
                          }
                        ],
                        "bass": null
                      }
                    }
                  ],
                  "number": 4,
                  "stated": false
                }
              ],
              "closeBar": null
            }
          ]
        }
      ],
      "groups": []
    }
  ],
  "blocks": [],
  "sung": false,
  "sungAt": null,
  "diagnostics": []
}
