{
  "title": "CRLF and a BOM",
  "properties": [
    {
      "key": "notation",
      "value": "American"
    }
  ],
  "sections": [
    {
      "name": "A",
      "heading": "markdown",
      "anchor": null,
      "body": [
        {
          "type": "music",
          "lines": [
            {
              "kind": "chart",
              "measures": [
                {
                  "bar": null,
                  "items": [
                    {
                      "type": "chord",
                      "symbol": "C9",
                      "index": 1,
                      "key": "C9",
                      "chord": {
                        "root": {
                          "letter": "C",
                          "accidental": 0
                        },
                        "quality": "major",
                        "extensions": [
                          {
                            "degree": 7,
                            "alter": -1
                          },
                          {
                            "degree": 9,
                            "alter": 0
                          }
                        ],
                        "bass": null
                      },
                      "ambiguities": [
                        {
                          "kind": "bareNine",
                          "chosen": "dominant",
                          "alternative": "add"
                        }
                      ]
                    }
                  ],
                  "number": 1,
                  "stated": false
                },
                {
                  "bar": "|",
                  "items": [
                    {
                      "type": "chord",
                      "symbol": "G",
                      "index": 1,
                      "key": "G",
                      "chord": {
                        "root": {
                          "letter": "G",
                          "accidental": 0
                        },
                        "quality": "major",
                        "extensions": [],
                        "bass": null
                      }
                    }
                  ],
                  "number": 2,
                  "stated": false
                }
              ],
              "closeBar": null
            }
          ]
        }
      ],
      "groups": []
    }
  ],
  "blocks": [
    {
      "label": "",
      "tuning": {
        "text": "E2 A2 D3 G3 B3 E4",
        "pitches": [
          {
            "note": {
              "letter": "E",
              "accidental": 0
            },
            "octave": 2
          },
          {
            "note": {
              "letter": "A",
              "accidental": 0
            },
            "octave": 2
          },
          {
            "note": {
              "letter": "D",
              "accidental": 0
            },
            "octave": 3
          },
          {
            "note": {
              "letter": "G",
              "accidental": 0
            },
            "octave": 3
          },
          {
            "note": {
              "letter": "B",
              "accidental": 0
            },
            "octave": 3
          },
          {
            "note": {
              "letter": "E",
              "accidental": 0
            },
            "octave": 4
          }
        ],
        "id": "40 45 50 55 59 64"
      },
      "voicings": [
        {
          "key": "C9",
          "symbol": "C9",
          "index": 1,
          "frets": [
            "x",
            3,
            2,
            3,
            3,
            0
          ]
        }
      ],
      "notes": []
    }
  ],
  "sung": false,
  "sungAt": null,
  "diagnostics": []
}
